{
  "active_chip": null,
  "content_sha256": "adcf0ca9c65e6da9323bb1a05953e4aedf6f6f8e6a610961b2f9c121939b1057",
  "episode_id": "benchmark-v0:2025-26:gw25:manager-neutral",
  "finance": {
    "bank_after": 1.8,
    "bank_before": 0.8,
    "free_transfers_before": 5,
    "hit_cost": 0,
    "transfer_count": 1
  },
  "frozen_at": "2026-02-06T18:30:00Z",
  "gameweek": 25,
  "lineup": {
    "bench_ids": [
      "player:2025-26:470",
      "player:2025-26:72",
      "player:2025-26:348",
      "player:2025-26:252"
    ],
    "captain_id": "player:2025-26:5",
    "formation": {
      "DEF": 3,
      "FWD": 2,
      "MID": 5
    },
    "starting_xi_ids": [
      "player:2025-26:220",
      "player:2025-26:5",
      "player:2025-26:226",
      "player:2025-26:260",
      "player:2025-26:21",
      "player:2025-26:82",
      "player:2025-26:329",
      "player:2025-26:47",
      "player:2025-26:382",
      "player:2025-26:430",
      "player:2025-26:136"
    ],
    "vice_captain_id": "player:2025-26:430"
  },
  "plan_id": "validated-plan:benchmark-v0:2025-26:gw25:manager-neutral:evidence_agent",
  "policy_arm": "evidence_agent",
  "previous_state_sha256": "8e6fb151d4d29a10a4197457848ad0b0763ba3d7f3bff247aa0efba00f4066a3",
  "ruleset": {
    "content_sha256": "376e6a7982b54bce8562a73cfd749f30c2d869c50bfa036a531b96c90bb5a809",
    "ruleset_id": "2025-26-v1.0"
  },
  "schema_version": "1.0",
  "season": "2025-26",
  "squad_after": [
    {
      "club_id": "team:2025-26:5",
      "player_id": "player:2025-26:136",
      "position": "FWD"
    },
    {
      "club_id": "team:2025-26:1",
      "player_id": "player:2025-26:21",
      "position": "MID"
    },
    {
      "club_id": "team:2025-26:7",
      "player_id": "player:2025-26:220",
      "position": "GKP"
    },
    {
      "club_id": "team:2025-26:7",
      "player_id": "player:2025-26:226",
      "position": "DEF"
    },
    {
      "club_id": "team:2025-26:7",
      "player_id": "player:2025-26:252",
      "position": "FWD"
    },
    {
      "club_id": "team:2025-26:13",
      "player_id": "player:2025-26:260",
      "position": "DEF"
    },
    {
      "club_id": "team:2025-26:10",
      "player_id": "player:2025-26:329",
      "position": "MID"
    },
    {
      "club_id": "team:2025-26:11",
      "player_id": "player:2025-26:348",
      "position": "DEF"
    },
    {
      "club_id": "team:2025-26:12",
      "player_id": "player:2025-26:382",
      "position": "MID"
    },
    {
      "club_id": "team:2025-26:13",
      "player_id": "player:2025-26:430",
      "position": "FWD"
    },
    {
      "club_id": "team:2025-26:2",
      "player_id": "player:2025-26:47",
      "position": "MID"
    },
    {
      "club_id": "team:2025-26:3",
      "player_id": "player:2025-26:470",
      "position": "GKP"
    },
    {
      "club_id": "team:2025-26:1",
      "player_id": "player:2025-26:5",
      "position": "DEF"
    },
    {
      "club_id": "team:2025-26:4",
      "player_id": "player:2025-26:72",
      "position": "DEF"
    },
    {
      "club_id": "team:2025-26:13",
      "player_id": "player:2025-26:82",
      "position": "MID"
    }
  ],
  "transfers": [
    {
      "player_in_id": "player:2025-26:329",
      "player_out_id": "player:2025-26:488",
      "position": "MID",
      "purchase_price": 6.1,
      "selling_price": 7.1
    }
  ],
  "validation": {
    "checks": [
      "predecessor_and_rules_bound",
      "transfer_finance_recomputed",
      "squad_legal",
      "lineup_legal_and_ordered",
      "chip_legal"
    ],
    "content_sha256": "433f7cb778502bd77427247b74b744d3ccf27fb71dddaa85964086af135a5636",
    "status": "passed"
  }
}
